RefSeq,Organism,Lineage,DoriC_oriC_0,DoriC_oriC_1,DoriC_oriC_2,DoriC_oriC_3,Sequence_length,False_order,GC_Concentration,oriC_middles_0,oriC_middles_1,oriC_middles_2,oriC_middles_3,oriC_middles_4,oriC_middles_5,oriC_middles_6,oriC_middles_7,oriC_middles_8,oriC_middles_9,Occurance_oriC_0,Occurance_oriC_1,Occurance_oriC_2,Occurance_oriC_3,Occurance_oriC_4,Occurance_oriC_5,Occurance_oriC_6,Occurance_oriC_7,Occurance_oriC_8,Occurance_oriC_9
NC_018672,Burkholderia phenoliruptrix BR3459a chromosome 2,"Bacteria, Proteobacteria, Betaproteobacteria, Burkholderiales, Burkholderiaceae, Burkholderia","(1336937.0, 1337287.0)",,,,2713495,False,0.6369777722089041,1329399,,,,,,,,,,1.0,,,,,,,,,
NZ_AP014635,"Vibrio tritonius DNA, chromosome 1, complete genome, strain: JCM 16456.","Bacteria, Proteobacteria, Gammaproteobacteria, Vibrionales, Vibrionaceae, Vibrio","(7411.0, 7720.0)",,,,3434724,False,0.4395782601455022,3434222,,,,,,,,,,1.0,,,,,,,,,
NZ_CP014167,"Paenibacillus yonginensis strain DCY84 chromosome, complete genome.","Bacteria, Firmicutes, Bacilli, Bacillales, Paenibacillaceae, Paenibacillus","(4180766.0, 4181471.0)","(4179136.0, 4179415.0)",,,4985901,False,0.5101443049109881,4177804,,,,,,,,,,1.0,,,,,,,,,
NZ_LT671418,"Herminiimonas sp. AS8 genome assembly, chromosome: I.","Bacteria, Proteobacteria, Betaproteobacteria, Burkholderiales, Oxalobacteraceae, Herminiimonas","(2539445.0, 2540199.0)",,,,3784322,False,0.5128369097555652,2485454,216.0,,,,,,,,,0.5,0.5,,,,,,,,
NZ_CP025543,"Spiroplasma monobiae MQ-1 chromosome, complete genome.","Bacteria, Tenericutes, Mollicutes, Entomoplasmatales, Spiroplasmataceae, Spiroplasma","(891289.0, 891575.0)",,,,891575,False,0.2775694697585733,887910,,,,,,,,,,1.0,,,,,,,,,
NZ_CP013119,"Alcaligenes faecalis strain ZD02, complete genome.","Bacteria, Proteobacteria, Betaproteobacteria, Burkholderiales, Alcaligenaceae, Alcaligenes","(2414896.0, 2415782.0)",,,,4233756,False,0.5682748368115688,2407386,4232907.0,,,,,,,,,0.5,0.5,,,,,,,,
NZ_CP025057,"Spiroplasma floricola strain 23-6 chromosome, complete genome.","Bacteria, Tenericutes, Mollicutes, Entomoplasmatales, Spiroplasmataceae, Spiroplasma","(1283845.0, 1284130.0)",,,,1284130,False,0.243325831496811,16,,,,,,,,,,1.0,,,,,,,,,
NZ_CP016534,"Planococcus antarcticus DSM 14505, complete genome.","Bacteria, Firmicutes, Bacilli, Bacillales, Planococcaceae, Planococcus","(3765056.0, 3765545.0)","(1345.0, 1515.0)",,,3765545,False,0.4323934516783095,3532,,,,,,,,,,1.0,,,,,,,,,
NZ_CP011797,"Reinekea forsetii strain Hel1_31_D35, complete genome.","Bacteria, Proteobacteria, Gammaproteobacteria, Oceanospirillales, Saccharospirillaceae, Reinekea","(3659504.0, 53.0)",,,,3660060,False,0.5299839346895953,3655476,,,,,,,,,,1.0,,,,,,,,,
NZ_CP013934,"Weissella cibaria strain CMS3, complete genome.","Bacteria, Firmicutes, Bacilli, Lactobacillales, Leuconostocaceae, Weissella","(18659.0, 19401.0)",,,,2342907,False,0.4531823072789487,19553,,,,,,,,,,1.0,,,,,,,,,
NZ_CP019573,"Auricoccus indicus strain S31 chromosome, complete genome.","Bacteria, Firmicutes, Bacilli, Bacillales, Staphylococcaceae, Auricoccucs","(1723654.0, 1724235.0)",,,,1745789,False,0.3406436860353685,1725025,,,,,,,,,,1.0,,,,,,,,,
NC_014962,Isosphaera pallida ATCC 43644 chromosome,"Bacteria, Planctomycetes, Planctomycetacia, Planctomycetales, Planctomycetaceae, Isosphaera","(3096175.0, 3097169.0)",,,,5472964,True,0.6244407966140468,2443074,7473.0,2931074.0,4593782.0,946590.0,,,,,,0.2307692307692307,0.2307692307692307,0.2307692307692307,0.2307692307692307,0.0769230769230769,,,,,
NC_019675,Cyanobium gracile PCC 6307 chromosome,"Bacteria, Cyanobacteria, Chroococcales, Cyanobium","(2314410.0, 2314782.0)",,,,3342364,True,0.6870717851197535,1676224,2902459.0,535710.0,,,,,,,,0.6470588235294118,0.1764705882352941,0.1764705882352941,,,,,,,
NC_014972,Desulfobulbus propionicus DSM 2032 chromosome,"Bacteria, Proteobacteria, Deltaproteobacteria, Desulfobacterales, Desulfobulbaceae, Desulfobulbus","(3694272.0, 3695029.0)",,,,3851869,True,0.5892757515896828,9668,3478278.0,,,,,,,,,0.7272727272727273,0.2727272727272727,,,,,,,,
NZ_CP012395,"Clostridium autoethanogenum DSM 10061, complete genome.","Bacteria, Firmicutes, Clostridia, Clostridiales, Clostridiaceae, Clostridium","(2263897.0, 2264152.0)","(2261947.0, 2262543.0)",,,4352446,False,0.3109210315303165,2276483,2680.0,,,,,,,,,0.5625,0.4375,,,,,,,,
NC_006833,Wolbachia endosymbiont strain TRS of Brugia malayi,"Bacteria, Proteobacteria, Alphaproteobacteria, Rickettsiales, Rickettsiaceae, Wolbachieae, Wolbachia","(1079740.0, 110.0)",,,,1080084,False,0.34179100884746,1072858,221094.0,,,,,,,,,0.7,0.3,,,,,,,,
NZ_CP022203,Myxococcus macrosporus DSM 14697 chromosome,"Bacteria, Proteobacteria, Deltaproteobacteria, Myxococcales,Cystobacterineae, Myxococcaceae, Myxococcus","(27600.0, 27964.0)",,,,8973512,False,0.7062036580549511,22856,,,,,,,,,,1.0,,,,,,,,,
NZ_CP006018,"Bifidobacterium indicum LMG 11587 = DSM 20214, complete genome.","Bacteria, Actinobacteria, Bifidobacteriales, Bifidobacteriaceae, Bifidobacterium","(1771.0, 2181.0)",,,,1734546,False,0.6049335099789801,8951,,,,,,,,,,1.0,,,,,,,,,
NZ_CP009108,"Bacillus pumilus strain GR-8, complete genome.","Bacteria, Firmicutes, Bacilli, Bacillales, Bacillaceae, Bacillus","(966904.0, 967099.0)","(964943.0, 965562.0)",,,3674849,False,0.4142439594116656,969279,30.0,,,,,,,,,0.6428571428571429,0.3571428571428571,,,,,,,,
NC_018178,Melioribacter roseus P3M chromosome,"Bacteria, Ignavibacteria, Ignavibacteria, Ignavibacteriales, Ignavibacteriaceae, Melioribacter","(1202105.0, 1202407.0)","(1200303.0, 1200691.0)",,,3300414,True,0.4132811823001599,8317,1226928.0,1535007.0,,,,,,,,0.4375,0.4375,0.125,,,,,,,
NC_009881,Rickettsia akari str. Hartford,"Bacteria, Proteobacteria, Alphaproteobacteria, Rickettsiales, Rickettsiaceae, Rickettsieae, Rickettsia, spotted fever group","(1230675.0, 1231060.0)",,,,1231060,False,0.3233473591863922,13152,1003074.0,,,,,,,,,0.75,0.25,,,,,,,,
NZ_CP015839,"Marinobacterium sp. ST58-10, complete genome.","Bacteria, Proteobacteria, Gammaproteobacteria, Oceanospirillales, Marinobacterium","(5182176.0, 5183215.0)",,,,5191608,False,0.5879157286143329,5226,,,,,,,,,,1.0,,,,,,,,,
NC_014118,Burkholderia sp. CCGE1002 chromosome chromosome 2,"Bacteria, Proteobacteria, Betaproteobacteria, Burkholderiales, Burkholderiaceae, Burkholderia","(2044492.0, 2045218.0)",,,,2593966,False,0.6322993439389722,2051785,1799234.0,2545739.0,,,,,,,,0.4666666666666667,0.3333333333333333,0.2,,,,,,,
NC_014119,Burkholderia sp. CCGE1002 chromosome chromosome 3,"Bacteria, Proteobacteria, Betaproteobacteria, Burkholderiales, Burkholderiaceae, Burkholderia","(740119.0, 741431.0)",,,,1282816,False,0.6261763183496308,743664,32665.0,,,,,,,,,0.75,0.25,,,,,,,,
NZ_CP015196,"Streptococcus marmotae strain HTS5 chromosome, complete genome.","Bacteria, Firmicutes, Bacilli, Lactobacillales, Streptococcaceae, Streptococcus","(783010.0, 783209.0)",,,,2309282,False,0.4092107416937385,781381,,,,,,,,,,1.0,,,,,,,,,
NC_014216,Desulfurivibrio alkaliphilus AHT2 chromosome,"Bacteria, Proteobacteria, Deltaproteobacteria, Desulfobacterales, Desulfobulbaceae, Desulfurivibrio","(2444764.0, 2445138.0)",,,,3097763,False,0.6028630983067459,2419325,,,,,,,,,,1.0,,,,,,,,,
NC_009633,Alkaliphilus metalliredigens QYMF,"Bacteria, Firmicutes, Clostridia, Clostridiales, Clostridiaceae, Alkaliphilus","(4928949.0, 49.0)","(1397.0, 1628.0)",,,4929566,False,0.3682202449465125,49778,,,,,,,,,,1.0,,,,,,,,,
NZ_CP018632,"Granulosicoccus antarcticus IMCC3135, complete genome.","Bacteria, Proteobacteria, Gammaproteobacteria, Chromatiales, Granulosicoccaceae, Granulosicoccus","(1694.0, 1955.0)",,,,7783862,False,0.528605209085156,3613,,,,,,,,,,1.0,,,,,,,,,
NZ_CP015438,"Anoxybacillus amylolyticus strain DSM 15939 chromosome, complete genome.","Bacteria, Firmicutes, Bacilli, Bacillales, Bacillaceae, Anoxybacillus","(192954.0, 193467.0)","(191437.0, 191606.0)",,,2834744,False,0.4368606124574212,188472,,,,,,,,,,1.0,,,,,,,,,
NZ_CP008849,"Alteromonas australica strain H 17, complete genome.","Bacteria, Proteobacteria, Gammaproteobacteria, Alteromonadales, Alteromonadaceae, Alteromonas","(4301292.0, 4301954.0)",,,,4308833,False,0.4493028622831286,4292786,,,,,,,,,,1.0,,,,,,,,,
NC_013642,Thermotoga naphthophila RKU-10,"Bacteria, Thermotogae, Thermotogales, Thermotogaceae, Thermotoga","(807603.0, 808159.0)",,,,1809823,False,0.4614075520092296,148206,793408.0,1127459.0,1314709.0,1541386.0,300999.0,1771858.0,448852.0,,,0.2058823529411764,0.2058823529411764,0.1470588235294117,0.1470588235294117,0.088235294117647,0.088235294117647,0.0588235294117647,0.0588235294117647,,
NZ_CP021425,"Oleiphilus messinensis strain ME102 chromosome, complete genome.","Bacteria, Proteobacteria, Gammaproteobacteria, Oceanospirillales, Oleiphilaceae, Oleiphilus","(6378208.0, 100.0)",,,,6379281,False,0.477966404050864,6378105,,,,,,,,,,1.0,,,,,,,,,
NZ_CP017111,Sulfurospirillum halorespirans DSM 13726 chromosome,"Bacteria, Proteobacteria, Epsilonproteobacteria, Campylobacterales,Campylobacteraceae, Sulfurospirillum","(3029840.0, 157.0)",,,,3029840,False,0.4131620811660021,694,,,,,,,,,,1.0,,,,,,,,,
NC_019566,Thalassobaculum sp. L2 chromosome,"Bacteria, Proteobacteria, Alphaproteobacteria, Rhodospirillales, Rhodospirillaceae, Candidatus Endolissoclinum","(1481175.0, 400.0)",,,,1481191,True,0.341450224852838,700740,564277.0,1480840.0,,,,,,,,0.4285714285714285,0.3333333333333333,0.238095238095238,,,,,,,
NC_013592,Dickeya dadantii Ech586,"Bacteria, Proteobacteria, Gammaproteobacteria, Enterobacteriales, Enterobacteriaceae, Dickeya","(4747164.0, 4747542.0)",,,,4818394,False,0.5363907559240693,4768265,,,,,,,,,,1.0,,,,,,,,,
NZ_CP017560,"Lysinibacillus sphaericus strain LMG 22257 chromosome, complete genome.","Bacteria, Firmicutes, Bacilli, Bacillales, Bacillaceae, Lysinibacillus","(234986.0, 235596.0)",,,,3436578,False,0.3899114176951607,246527,3430902.0,,,,,,,,,0.75,0.25,,,,,,,,
NZ_CP014035,"Vibrio fluvialis strain ATCC 33809 chromosome 2, complete sequence.","Bacteria, Proteobacteria, Gammaproteobacteria, Vibrionales, Vibrionaceae, Vibrio","(2724690.0, 2724998.0)",,,,3155838,True,0.5003894369736342,6280,2721510.0,,,,,,,,,0.5,0.5,,,,,,,,
NZ_CP019698,"Desulfotomaculum ferrireducens strain GSS09 chromosome, complete genome.","Bacteria, Firmicutes, Clostridia, Clostridiales, Peptococcaceae, Desulfotomaculum","(122552.0, 122926.0)",,,,3240180,False,0.4537908387805616,76081,,,,,,,,,,1.0,,,,,,,,,
NZ_CP007445,"Gilliamella apicola strain wkB1, complete genome.","Bacteria, Proteobacteria, Gammaproteobacteria, Orbales, Orbaceae, Gilliamella","(1.0, 942.0)",,,,3139412,False,0.3361728247200431,3139161,2006769.0,,,,,,,,,0.8181818181818182,0.1818181818181818,,,,,,,,
NZ_CP007501,"Polynucleobacter duraquae strain MWH-MoK4, complete genome.","Bacteria, Proteobacteria, Betaproteobacteria, Burkholderiales, Burkholderiaceae, Polynucleobacter","(2026072.0, 45.0)","(1426.0, 1690.0)",,,2026292,False,0.4516012499679217,653,,,,,,,,,,1.0,,,,,,,,,
NC_018149,Mycoplasma wenyonii str. Massachusetts chromosome,"Bacteria, Tenericutes, Mollicutes, Mycoplasmataceae, Mycoplasma","(650129.0, 174.0)",,,,650228,True,0.3392225496287456,636658,324995.0,157195.0,395684.0,94692.0,,,,,,0.391304347826087,0.217391304347826,0.1739130434782608,0.1304347826086956,0.0869565217391304,,,,,
NC_017082,Bradyrhizobium sp. S23321,"Bacteria, Proteobacteria, Alphaproteobacteria, Rhizobiales, Bradyrhizobiaceae, Bradyrhizobium","(7230597.0, 7231841.0)",,,,7231841,False,0.6429802591069135,136845,,,,,,,,,,1.0,,,,,,,,,
NZ_CP016757,"Cloacibacillus porcorum strain CL-84 chromosome, complete genome.","Bacteria, Synergistetes, Synergistia, Synergistales, Synergistaceae, Cloacibacillus","(3584800.0, 323.0)","(1659.0, 1887.0)",,,3585187,False,0.5483881314977433,13356,,,,,,,,,,1.0,,,,,,,,,
NZ_AP014509,Thermotoga caldifontis AZM44c09 DNA,"Bacteria, Thermotogae, Thermotogales, Thermotogaceae, Thermotoga","(315913.0, 316450.0)",,,,2014912,True,0.5133315995934313,2930,301731.0,1444131.0,,,,,,,,0.5294117647058824,0.2941176470588235,0.1764705882352941,,,,,,,
NC_014666,Frankia sp. EuI1c chromosome,"Bacteria, Actinobacteria, Actinobacteridae, Actinomycetales, Frankineae, Frankiaceae, Frankia","(1691.0, 2875.0)",,,,8815781,False,0.7231400144808497,8810377,,,,,,,,,,1.0,,,,,,,,,
NZ_AP014510,Thermotoga profunda AZM34c06 DNA,"Bacteria, Thermotogae, Thermotogales, Thermotogaceae, Thermotoga","(89175.0, 89775.0)",,,,2187612,True,0.3879673360723931,1453820,270157.0,804755.0,14447.0,,,,,,,0.4090909090909091,0.3181818181818182,0.1363636363636363,0.1363636363636363,,,,,,
NC_015514,Cellulomonas fimi ATCC 484 chromosome,"Bacteria, Actinobacteria, Actinobacteridae, Actinomycetales, Micrococcineae, Cellulomonadaceae, Cellulomonas","(1572.0, 2400.0)",,,,4266344,False,0.7472433071501032,5456,3668320.0,2032694.0,3209380.0,811070.0,,,,,,0.375,0.2916666666666667,0.125,0.125,0.0833333333333333,,,,,
NC_010547,Cyanothece sp. ATCC 51142 chromosome linear,"Bacteria, Cyanobacteria, Chroococcales, Cyanothece","(373518.0, 373849.0)",,,,429701,True,0.3856867915131685,235899,27971.0,357335.0,,,,,,,,0.3333333333333333,0.3333333333333333,0.3333333333333333,,,,,,,
NZ_CP006841,"Corynebacterium lactis RW2-5, complete genome.","Bacteria, Actinobacteria, Corynebacteriales, Corynebacteriaceae, Corynebacterium","(2769010.0, 2769745.0)","(1657.0, 2077.0)",,,2769745,False,0.6052979606425862,749,,,,,,,,,,1.0,,,,,,,,,
NC_021870,Salmonella bongori N268-08,"Bacteria, Proteobacteria, Gammaproteobacteria, Enterobacteriales, Enterobacteriaceae, Salmonella","(3927084.0, 3927461.0)",,,,4683551,False,0.5134115119062438,3929754,,,,,,,,,,1.0,,,,,,,,,
NC_020419,Uncultured Termite group 1 bacterium phylotype Rs-D17 DNA,"Bacteria, Elusimicrobia, environmental samples","(1125789.0, 981.0)",,,,1125857,False,0.3520740200576094,203,224241.0,,,,,,,,,0.75,0.25,,,,,,,,
NC_013740,Mycobacterium bovis BCG strain 3281,"Bacteria, Firmicutes, Clostridia, Clostridiales, Veillonellaceae, Acidaminococcus","(1195.0, 1915.0)","(2540.0, 2750.0)","(4140.0, 4386.0)","(2329473.0, 33.0)",2329769,False,0.5584270371869485,13130,,,,,,,,,,1.0,,,,,,,,,
NZ_CP009498,"Endomicrobium proavitum strain Rsa215, complete genome.","Bacteria, Elusimicrobia, Endomicrobia, Endomicrobiales, Endomicrobiaceae, Endomicrobium","(1332129.0, 1332528.0)",,,,1588979,True,0.3934161496155707,3811,1334062.0,,,,,,,,,0.75,0.25,,,,,,,,
NZ_CP017279,"Enterobacter ludwigii strain EN-119 chromosome, complete genome.","Bacteria, Proteobacteria, Gammaproteobacteria, Enterobacterales, Enterobacteriaceae, Enterobacter, Enterobacter cloacae complex","(3205100.0, 3205473.0)",,,,4857439,False,0.5459597125151752,3203986,696.0,3671697.0,,,,,,,,0.6428571428571429,0.2142857142857142,0.1428571428571428,,,,,,,
NC_015064,Acidobacterium sp. MP5ACTX9 chromosome,"Bacteria, Acidobacteria, Acidobacteriales, Acidobacteriaceae, Acidobacterium","(2438.0, 3077.0)",,,,4309153,True,0.6051388753195813,4280922,400360.0,1031269.0,2607591.0,,,,,,,0.3076923076923077,0.2307692307692307,0.2307692307692307,0.2307692307692307,,,,,,
NC_015671,Cellvibrio gilvus ATCC 13127 chromosome,"Bacteria, Proteobacteria, Gammaproteobacteria, Pseudomonadales, Pseudomonadaceae, Cellvibrio","(3492014.0, 3492302.0)",,,,3526441,False,0.7381288953934009,3516499,,,,,,,,,,1.0,,,,,,,,,
NC_018419,Secondary endosymbiont of Ctenarytaina eucalypti chromosome,"Bacteria, Proteobacteria, Gammaproteobacteria, Enterobacteriales, Enterobacteriaceae, aphid secondary symbionts","(973897.0, 976015.0)","(970051.0, 971979.0)",,,1441139,False,0.4329020309630091,974965,677026.0,,,,,,,,,0.6,0.4,,,,,,,,
NZ_CP010427,"Allofrancisella guangzhouensis strain 08HL01032 chromosome, complete genome.","Bacteria, Proteobacteria, Gammaproteobacteria, Thiotrichales, Francisellaceae, Allofrancisella","(282042.0, 282520.0)",,,,1658482,False,0.3199660894721799,276330,,,,,,,,,,1.0,,,,,,,,,
NZ_CP015519,"Pelobacter sp. SFB93, complete genome.","Bacteria, Proteobacteria, Deltaproteobacteria, Desulfuromonadales, Desulfuromonadaceae, Pelobacter","(2267797.0, 2268133.0)",,,,3218469,False,0.5341173085712493,2268122,3211703.0,,,,,,,,,0.6923076923076923,0.3076923076923077,,,,,,,,
NZ_CP018312,"Vibrio rotiferianus B64D1 chromosome 2, complete sequence.","Bacteria, Proteobacteria, Gammaproteobacteria, Vibrionales, Vibrionaceae, Vibrio","(3116149.0, 3116617.0)",,,,3326271,True,0.4499065169374353,3115364,1.0,,,,,,,,,0.75,0.25,,,,,,,,
NC_021663,Corynebacterium terpenotabidum Y-11,"Bacteria, Actinobacteria, Actinobacteridae, Actinomycetales, Corynebacterineae, Corynebacteriaceae, Corynebacterium","(2750411.0, 2751233.0)","(1618.0, 2342.0)",,,2751233,False,0.6701758811412919,11545,2452813.0,259927.0,,,,,,,,0.5238095238095238,0.2857142857142857,0.1904761904761904,,,,,,,
NC_012691,Tolumonas auensis DSM 9187,"Bacteria, Proteobacteria, Gammaproteobacteria, Aeromonadales, Aeromonadaceae, Tolumonas","(3442853.0, 3443403.0)",,,,3471292,False,0.4902701933458781,3447068,,,,,,,,,,1.0,,,,,,,,,
NC_012115,Nautilia profundicola AmH,"Bacteria, Proteobacteria, Epsilonproteobacteria, Nautiliales, Nautiliaceae, Nautilia","(1676387.0, 100.0)",,,,1676444,False,0.3350753141769125,7936,1377248.0,,,,,,,,,0.8181818181818182,0.1818181818181818,,,,,,,,
NC_006461,Thermus thermophilus HB8,"Bacteria, Deinococcus-Thermus, Deinococci, Thermales, Thermaceae, Thermus","(1849496.0, 54.0)",,,,1849742,True,0.6951785708493401,1849736,343360.0,1638531.0,986567.0,,,,,,,0.45,0.3,0.15,0.1,,,,,,
NZ_CP011883,"Mycobacterium haemophilum DSM 44634 strain ATCC 29548, complete genome.","Bacteria, Actinobacteria, Corynebacteriales, Mycobacteriaceae, Mycobacterium","(1528.0, 2057.0)",,,,4235765,False,0.6394795273108872,9507,,,,,,,,,,1.0,,,,,,,,,
NC_014392,Caldicellulosiruptor obsidiansis OB47 chromosome,"Bacteria, Firmicutes, Clostridia, Thermoanaerobacterales, Thermoanaerobacterales Family III. Incertae Sedis, Caldicellulosiruptor","(2532011.0, 116.0)","(1482.0, 2330.0)",,,2532343,False,0.3524329050211602,8426,,,,,,,,,,1.0,,,,,,,,,
NC_018416,Candidatus Carsonella ruddii HC isolate Thao2000 chromosome,"Bacteria, Proteobacteria, Gammaproteobacteria, Candidatus Carsonella","(154894.0, 155208.0)",,,,166163,True,0.1417764484271468,81124,99070.0,158774.0,15721.0,,,,,,,0.4375,0.25,0.1875,0.125,,,,,,
NZ_CP019323,"Lactobacillus allii strain WiKim39 chromosome, complete genome.","Bacteria, Firmicutes, Bacilli, Lactobacillales, Lactobacillaceae, Lactobacillus","(613008.0, 613546.0)",,,,2506167,False,0.3530399211225748,613792,,,,,,,,,,1.0,,,,,,,,,
NC_017161,Hydrogenobacter thermophilus TK-6 chromosome,"Bacteria, Aquificae, Aquificales, Aquificaceae, Hydrogenobacter","(1361.0, 2351.0)",,,,1742932,True,0.4400085602880663,1098981,495297.0,274057.0,1734707.0,846384.0,666756.0,,,,,0.2325581395348837,0.2093023255813953,0.1627906976744186,0.1627906976744186,0.1627906976744186,0.0697674418604651,,,,
NZ_CP013187,"Pseudoalteromonas phenolica strain KCTC 12086 chromosome 1, complete sequence.","Bacteria, Proteobacteria, Gammaproteobacteria, Alteromonadales, Pseudoalteromonadaceae, Pseudoalteromonas","(3845245.0, 276.0)",,,,3845520,False,0.4078592752085543,3843190,,,,,,,,,,1.0,,,,,,,,,
NZ_CP009249,"Corynebacterium phocae strain M408/89/1, complete genome.","Bacteria, Actinobacteria, Corynebacteriales, Corynebacteriaceae, Corynebacterium","(2778976.0, 6.0)","(1705.0, 2263.0)",,,2779609,False,0.5883403025389542,2773650,,,,,,,,,,1.0,,,,,,,,,
NZ_CP007142,"Gynuella sunshinyii YC6258, complete genome.","Bacteria, Proteobacteria, Gammaproteobacteria, Oceanospirillales, Saccharospirillaceae, Gynuella","(557938.0, 558571.0)",,,,6475959,False,0.4863278164670283,585279,,,,,,,,,,1.0,,,,,,,,,
NC_014376,Clostridium saccharolyticum WM1 chromosome,"Bacteria, Firmicutes, Clostridia, Clostridiales, Clostridiaceae, Clostridium","(4662490.0, 81.0)","(1459.0, 1716.0)",,,4662871,False,0.4500474064154895,2899,,,,,,,,,,1.0,,,,,,,,,
NC_018507,Candidatus Portiera aleyrodidarum BT-B chromosome,"Bacteria, Proteobacteria, Gammaproteobacteria, Oceanospirillales, Halomonadaceae, Zymobacter group, whitefly endosymbionts, Candidatus Portiera","(37960.0, 40975.0)",,,,358242,True,0.2617364798097376,340433,17706.0,242156.0,305208.0,50617.0,202680.0,,,,,0.3,0.2333333333333333,0.2333333333333333,0.1,0.0666666666666666,0.0666666666666666,,,,
NZ_CP011311,"Corynebacterium camporealensis strain DSM 44610, complete genome.","Bacteria, Actinobacteria, Corynebacteriales, Corynebacteriaceae, Corynebacterium","(2451176.0, 2451810.0)","(1636.0, 2215.0)",,,2451810,False,0.5940749894975549,45609,1740945.0,2226274.0,1126385.0,273174.0,,,,,,0.3448275862068966,0.2413793103448276,0.1724137931034483,0.1379310344827586,0.1034482758620689,,,,,
NC_009504,Brucella ovis ATCC 25840 chromosome 1I,"Bacteria, Proteobacteria, Alphaproteobacteria, Rhizobiales, Brucellaceae, Brucella","(1164007.0, 153.0)",,,,1164220,False,0.5722552438542543,1163509,,,,,,,,,,1.0,,,,,,,,,
NC_009379,Polynucleobacter sp. QLW-P1DMWA-1,"Bacteria, Proteobacteria, Betaproteobacteria, Burkholderiales, Burkholderiaceae, Polynucleobacter","(2159301.0, 32.0)","(1461.0, 1723.0)",,,2159490,False,0.4483410434871196,2158624,,,,,,,,,,1.0,,,,,,,,,
NZ_CP010827,"Corynebacterium singulare strain IBS B52218, complete genome.","Bacteria, Actinobacteria, Corynebacteriales, Corynebacteriaceae, Corynebacterium","(2829705.0, 2830477.0)",,,,2830519,False,0.601186920137261,5819,2087436.0,2583703.0,1255513.0,,,,,,,0.4666666666666667,0.2,0.2,0.1333333333333333,,,,,,
NZ_CP014870,"Pseudomonas sp. A3(2016), complete genome.","Bacteria, Proteobacteria, Gammaproteobacteria, Pseudomonadales, Pseudomonadaceae, Pseudomonas","(6763089.0, 6763654.0)",,,,6823539,False,0.5958248351771712,6783108,1817688.0,,,,,,,,,0.6153846153846154,0.3846153846153846,,,,,,,,
NC_020283,Candidatus Kinetoplastibacterium crithidii TCC036E,"Bacteria, Proteobacteria, Betaproteobacteria, Kinetoplastibacterium","(817549.0, 817826.0)",,,,821930,False,0.3096346404195004,820115,,,,,,,,,,1.0,,,,,,,,,
NZ_CP008998,"Xanthomonas citri subsp. citri strain MN12, complete genome.","Bacteria, Proteobacteria, Gammaproteobacteria, Xanthomonadales, Xanthomonadaceae, Xanthomonas","(2748.0, 3798.0)",,,,5124831,False,0.6483891859068133,5049810,269294.0,,,,,,,,,0.7,0.3,,,,,,,,
NC_020294,Candidatus Kinetoplastibacterium desouzaii TCC079E,"Bacteria, Proteobacteria, Betaproteobacteria, Kinetoplastibacterium","(828463.0, 828989.0)",,,,833125,False,0.3017422355588897,831500,,,,,,,,,,1.0,,,,,,,,,
NC_020299,Candidatus Kinetoplastibacterium oncopeltii TCC290E,"Bacteria, Proteobacteria, Betaproteobacteria, Kinetoplastibacterium","(805803.0, 806024.0)",,,,810172,True,0.3122978824249665,808150,645923.0,,,,,,,,,0.8181818181818182,0.1818181818181818,,,,,,,,
NC_018721,Psychroflexus torquis ATCC 700755 chromosome,"Bacteria, Bacteroidetes, Flavobacteriia, Flavobacteriales, Flavobacteriaceae, Psychroflexus","(2013077.0, 2013731.0)",,,,4321832,True,0.3452528927547392,21626,2040870.0,3187966.0,,,,,,,,0.4,0.3,0.3,,,,,,,
NC_011958,Rhodobacter sphaeroides KD131 chromosome 2,"Bacteria, Proteobacteria, Alphaproteobacteria, Rhodobacterales, Rhodobacteraceae, Rhodobacter","(1057991.0, 1058774.0)",,,,1297647,True,0.6870628144634096,14501,144517.0,890797.0,284790.0,1060016.0,,,,,,0.2777777777777778,0.25,0.1944444444444444,0.1944444444444444,0.0833333333333333,,,,,
NC_020284,Candidatus Kinetoplastibacterium galatii TCC219,"Bacteria, Proteobacteria, Betaproteobacteria, Kinetoplastibacterium","(817752.0, 817973.0)",,,,822140,True,0.3235860072493736,820125,583806.0,315741.0,,,,,,,,0.6428571428571429,0.2142857142857142,0.1428571428571428,,,,,,,
NC_019814,Candidatus Kinetoplastibacterium blastocrithidii (ex Strigomonas culicis) chromosome,"Bacteria, Proteobacteria, Betaproteobacteria, Kinetoplastibacterium","(166548.0, 166765.0)",,,,820037,True,0.325456046495463,816490,203965.0,,,,,,,,,0.75,0.25,,,,,,,,
NZ_CP013652,"Paenibacillus naphthalenovorans strain 32O-Y, complete genome.","Bacteria, Firmicutes, Bacilli, Bacillales, Paenibacillaceae, Paenibacillus","(4279971.0, 4280525.0)","(4278387.0, 4278599.0)",,,5200139,False,0.4968944099378882,4276267,,,,,,,,,,1.0,,,,,,,,,
NZ_CP018776,"Staphylococcus condimenti strain StO 2014-01 chromosome, complete genome.","Bacteria, Firmicutes, Bacilli, Bacillales, Staphylococcaceae, Staphylococcus","(2665507.0, 497.0)","(1860.0, 2113.0)",,,2665650,False,0.3461939864573368,6888,,,,,,,,,,1.0,,,,,,,,,
NC_013222,Robiginitalea biformata HTCC2501,"Bacteria, Bacteroidetes, Flavobacteria, Flavobacteriales, Flavobacteriaceae, Robiginitalea","(758716.0, 759011.0)",,,,3530383,True,0.5529329254078098,828520,3530369.0,3110939.0,,,,,,,,0.5833333333333334,0.25,0.1666666666666666,,,,,,,
NC_015519,Tepidanaerobacter sp. Re1 chromosome,"Bacteria, Firmicutes, Clostridia, Thermoanaerobacterales, Thermoanaerobacteraceae, Tepidanaerobacter","(1453.0, 1711.0)",,,,2759867,False,0.3753430871849984,2756754,,,,,,,,,,1.0,,,,,,,,,
NZ_LT906447,"Staphylococcus piscifermentans strain NCTC13836 genome assembly, chromosome: 1.","Bacteria, Firmicutes, Bacilli, Bacillales, Staphylococcaceae, Staphylococcus","(2612630.0, 2613271.0)","(1363.0, 1620.0)",,,2613271,False,0.3670212542059358,2611556,,,,,,,,,,1.0,,,,,,,,,
NC_014414,Parvularcula bermudensis HTCC2503 chromosome,"Bacteria, Proteobacteria, Alphaproteobacteria, Parvularculales, Parvularculaceae, Parvularcula","(808220.0, 808571.0)",,,,2902643,True,0.6065609859703726,1303,798706.0,1130425.0,,,,,,,,0.391304347826087,0.391304347826087,0.217391304347826,,,,,,,
NZ_LT605586,Brucella sp. 141012304 genome assembly,"Bacteria, Proteobacteria, Alphaproteobacteria, Rhizobiales,Brucellaceae, Brucella","(1090781.0, 1091149.0)",,,,1296428,False,0.5706232818174245,2864,1088247.0,854234.0,,,,,,,,0.45,0.45,0.1,,,,,,,
