RefSeq,Organism,Lineage,DoriC_oriC_0,DoriC_oriC_1,DoriC_oriC_2,DoriC_oriC_3,Sequence_length,False_order,GC_Concentration,oriC_middles_0,oriC_middles_1,oriC_middles_2,oriC_middles_3,oriC_middles_4,oriC_middles_5,oriC_middles_6,oriC_middles_7,oriC_middles_8,oriC_middles_9,Occurance_oriC_0,Occurance_oriC_1,Occurance_oriC_2,Occurance_oriC_3,Occurance_oriC_4,Occurance_oriC_5,Occurance_oriC_6,Occurance_oriC_7,Occurance_oriC_8,Occurance_oriC_9
NC_015968,Enterobacter asburiae LF7a chromosome,"Bacteria, Proteobacteria, Gammaproteobacteria, Enterobacteriales, Enterobacteriaceae, Enterobacter, Enterobacter cloacae complex","(4766429.0, 4766802.0)",,,,4812833,False,0.5385038292415298,4786240,,,,,,,,,,1.0,,,,,,,,,
NC_013720,Pirellula staleyi DSM 6068,"Bacteria, Planctomycetes, Planctomycetacia, Planctomycetales, Planctomycetaceae, Pirellula","(1281155.0, 1281631.0)",,,,6196199,False,0.574646973087856,1284099,1826297.0,6196179.0,,,,,,,,0.6428571428571429,0.2142857142857142,0.1428571428571428,,,,,,,
NZ_CP021377,"Oceanisphaera profunda strain SM1222 chromosome, complete genome.","Bacteria, Proteobacteria, Gammaproteobacteria, Aeromonadales, Aeromonadaceae, Oceanisphaera","(1723847.0, 1724336.0)",,,,3508860,False,0.4977291769976573,1708573,,,,,,,,,,1.0,,,,,,,,,
NZ_CP019640,"Planococcus maritimus strain Y42 chromosome, complete genome.","Bacteria, Firmicutes, Bacilli, Bacillales, Planococcaceae, Planococcus","(3718418.0, 3718896.0)","(1345.0, 1522.0)",,,3718896,False,0.4875401194332942,3739,,,,,,,,,,1.0,,,,,,,,,
NZ_CP018888,"Lactobacillus amylophilus DSM 20533 = JCM 1125, complete genome.","Bacteria, Firmicutes, Bacilli, Lactobacillales, Lactobacillaceae, Lactobacillus","(762543.0, 763021.0)",,,,1610352,False,0.436536235555953,765229,347961.0,,,,,,,,,0.75,0.25,,,,,,,,
NZ_AP012544,"Lactobacillus casei subsp. casei ATCC 393 DNA, complete genome.","Bacteria, Firmicutes, Bacilli, Lactobacillales, Lactobacillaceae, Lactobacillus","(1351.0, 1523.0)",,,,2924929,False,0.479152485410757,2921954,,,,,,,,,,1.0,,,,,,,,,
NZ_CP016174,"Amycolatopsis orientalis strain B-37, complete genome.","Bacteria, Actinobacteria, Pseudonocardiales, Pseudonocardiaceae, Amycolatopsis","(9489859.0, 9490992.0)",,,,9490992,False,0.6882991788424224,26951,8617578.0,,,,,,,,,0.75,0.25,,,,,,,,
NZ_CP009286,"Paenibacillus stellifer strain DSM 14472, complete genome.","Bacteria, Firmicutes, Bacilli, Bacillales, Paenibacillaceae, Paenibacillus","(5658214.0, 86.0)",,,,5658798,False,0.5354289020389136,3026,,,,,,,,,,1.0,,,,,,,,,
NZ_CP016210,"Azoarcus olearius strain DQS4, complete genome.","Bacteria, Proteobacteria, Betaproteobacteria, Rhodocyclales, Zoogloeaceae, Azoarcus","(4436121.0, 4436511.0)",,,,4451751,False,0.6783333119934156,35873,,,,,,,,,,1.0,,,,,,,,,
NC_022905,Brucella ceti TE10759-12 chromosome 1,"Bacteria, Proteobacteria, Alphaproteobacteria, Rhizobiales, Brucellaceae, Brucella","(2117647.0, 191.0)",,,,2117718,False,0.5715822408838193,2267,387881.0,,,,,,,,,0.6,0.4,,,,,,,,
NC_022906,Brucella ceti TE10759-12 chromosome 2,"Bacteria, Proteobacteria, Alphaproteobacteria, Rhizobiales, Brucellaceae, Brucella","(91699.0, 92065.0)",,,,1160316,False,0.5735497916084928,99993,,,,,,,,,,1.0,,,,,,,,,
NC_013422,Halothiobacillus neapolitanus c2,"Bacteria, Proteobacteria, Gammaproteobacteria, Chromatiales, Halothiobacillaceae, Halothiobacillus","(2508187.0, 2508603.0)",,,,2582886,True,0.5471364202678709,2580806,250949.0,,,,,,,,,0.8,0.2,,,,,,,,
NC_023063,Ehrlichia muris AS145,"Bacteria, Proteobacteria, Alphaproteobacteria, Rickettsiales, Anaplasmataceae, Ehrlichia","(1.0, 423.0)",,,,1196717,False,0.2966407262535754,1401,,,,,,,,,,1.0,,,,,,,,,
NC_008825,Methylibium petroleiphilum PM1,"Bacteria, Proteobacteria, Betaproteobacteria, Burkholderiales, Methylibium","(4044058.0, 185.0)","(1590.0, 1823.0)",,,4044195,False,0.6919775134482882,4035618,444571.0,,,,,,,,,0.5625,0.4375,,,,,,,,
NZ_CP022096,"Staphylococcus pettenkoferi strain FDAARGOS_288 chromosome, complete genome.","Bacteria, Firmicutes, Bacilli, Bacillales, Staphylococcaceae, Staphylococcus","(1843748.0, 1844474.0)","(1842157.0, 1842388.0)",,,2502360,False,0.3891626304768298,1823606,,,,,,,,,,1.0,,,,,,,,,
NZ_CP024610,"Lactobacillales bacterium strain NIBRBAC000499792 chromosome, complete genome.","Bacteria, Firmicutes, Bacilli, Lactobacillales, unclassified Lactobacillales (miscellaneous)","(275732.0, 275896.0)","(273878.0, 274354.0)",,,1548794,True,0.3308206255964318,8051,306779.0,,,,,,,,,0.7,0.3,,,,,,,,
NZ_CP017269,"Geosporobacter ferrireducens strain IRF9 chromosome, complete genome.","Bacteria, Firmicutes, Clostridia, Clostridiales, Clostridiaceae, Geosporobacter","(2828675.0, 2829267.0)","(2827107.0, 2827339.0)",,,5792634,False,0.3860932694867309,2824005,,,,,,,,,,1.0,,,,,,,,,
NZ_CP018135,"Neomicrococcus aestuarii strain B18, complete genome.","Bacteria, Actinobacteria, Micrococcales, Micrococcaceae, Neomicrococcus","(1863771.0, 1864155.0)","(1861909.0, 1862339.0)",,,2667837,False,0.5914615473134228,1902412,,,,,,,,,,1.0,,,,,,,,,
NC_019892,Singulisphaera acidiphila DSM 18658 chromosome,"Bacteria, Planctomycetes, Planctomycetia, Planctomycetales, Planctomycetaceae, Singulisphaera","(9528246.0, 9529015.0)",,,,9629675,True,0.6226605778492005,4617387,102938.0,,,,,,,,,0.5,0.5,,,,,,,,
NZ_LT906441,"Cutibacterium granulosum strain NCTC11865 genome assembly, chromosome: 1.","Bacteria, Actinobacteria, Propionibacteriales, Propionibacteriaceae, Cutibacterium","(495100.0, 495635.0)",,,,2175244,True,0.6419040806456655,8994,500125.0,1284460.0,,,,,,,,0.45,0.45,0.1,,,,,,,
NC_009831,Shewanella sediminis HAW-EB3,"Bacteria, Proteobacteria, Gammaproteobacteria, Alteromonadales, Shewanellaceae, Shewanella","(4368.0, 4811.0)",,,,5517674,False,0.4607787629352513,5510969,,,,,,,,,,1.0,,,,,,,,,
NC_022663,Mycobacterium kansasii ATCC 12478,"Bacteria, Actinobacteria, Actinobacteridae, Actinomycetales, Corynebacterineae, Mycobacteriaceae, Mycobacterium","(3241172.0, 3241681.0)","(3238910.0, 3239566.0)",,,6432277,False,0.6623954472109954,3245920,6045724.0,,,,,,,,,0.6923076923076923,0.3076923076923077,,,,,,,,
NC_015945,Muricauda ruestringensis DSM 13258 chromosome,"Bacteria, Bacteroidetes, Flavobacteriia, Flavobacteriales, Flavobacteriaceae, Muricauda","(1428186.0, 1428778.0)",,,,3842422,False,0.4135797681774672,1368131,3366079.0,1791130.0,,,,,,,,0.6,0.2,0.2,,,,,,,
NC_023065,Magnetospirillum gryphiswaldense MSR-1 v2,"Bacteria, Proteobacteria, Alphaproteobacteria, Rhodospirillales, Rhodospirillaceae, Magnetospirillum","(3388932.0, 3389333.0)",,,,4365796,False,0.6328497712673703,13763,,,,,,,,,,1.0,,,,,,,,,
NC_011963,Rhodobacter sphaeroides KD131 chromosome 1,"Bacteria, Proteobacteria, Alphaproteobacteria, Rhodobacterales, Rhodobacteraceae, Rhodobacter","(2678294.0, 2678681.0)",,,,3152792,False,0.6917614609527047,2709179,429996.0,,,,,,,,,0.5,0.5,,,,,,,,
NC_010505,Methylobacterium radiotolerans JCM 2831,"Bacteria, Proteobacteria, Alphaproteobacteria, Rhizobiales, Methylobacteriaceae, Methylobacterium","(4549435.0, 4549921.0)",,,,6077833,True,0.715020797708657,515999,4917.0,4075156.0,3354152.0,2194582.0,1631203.0,2722091.0,4639408.0,,,0.1836734693877551,0.1836734693877551,0.1836734693877551,0.1632653061224489,0.1020408163265306,0.1020408163265306,0.0408163265306122,0.0408163265306122,,
NC_013385,Ammonifex degensii KC4,"Bacteria, Firmicutes, Clostridia, Thermoanaerobacterales, Thermoanaerobacteraceae, Moorella group, Ammonifex","(2129201.0, 187.0)",,,,2129237,False,0.5944843152734994,1243,373163.0,,,,,,,,,0.6923076923076923,0.3076923076923077,,,,,,,,
NZ_LN681225,"Legionella hackeliae genome assembly LHA, chromosome : I.","Bacteria, Proteobacteria, Gammaproteobacteria, Legionellales, Legionellaceae, Legionella","(3440940.0, 671.0)",,,,3440975,False,0.3902097515965678,3432820,,,,,,,,,,1.0,,,,,,,,,
NZ_CP006764,"Corynebacterium doosanense CAU 212 = DSM 45436, complete genome.","Bacteria, Actinobacteria, Corynebacteriales, Corynebacteriaceae, Corynebacterium","(2670972.0, 2671798.0)","(1570.0, 2434.0)",,,2671798,False,0.66848541693646,10876,1405814.0,2205912.0,1705866.0,608409.0,854092.0,,,,,0.3214285714285714,0.25,0.1071428571428571,0.1071428571428571,0.1071428571428571,0.1071428571428571,,,,
NZ_CP009245,"Corynebacterium aquilae DSM 44791 strain S-613, complete genome.","Bacteria, Actinobacteria, Corynebacteriales, Corynebacteriaceae, Corynebacterium","(2924948.0, 101.0)","(1962.0, 2961.0)",,,2926437,True,0.6091701273596527,391178,1381167.0,854518.0,2173754.0,1913152.0,1103808.0,2475240.0,,,,0.2857142857142857,0.2142857142857142,0.1666666666666666,0.1666666666666666,0.0714285714285714,0.0476190476190476,0.0476190476190476,,,
NZ_CP006950,Dehalococcoides mccartyi CG4,"Bacteria, Chloroflexi, Dehalococcoidia, Dehalococcoidales,Dehalococcoidaceae, Dehalococcoides","(1599.0, 1925.0)",,,,1382308,False,0.4871960518205783,1710,,,,,,,,,,1.0,,,,,,,,,
NC_017098,Spirochaeta africana DSM 8902 chromosome,"Bacteria, Spirochaetes, Spirochaetales, Spirochaetaceae, Spirochaeta","(1402.0, 1632.0)",,,,3285855,False,0.5776615218869975,9782,1178193.0,,,,,,,,,0.8571428571428571,0.1428571428571428,,,,,,,,
NC_010729,Porphyromonas gingivalis ATCC 33277,"Bacteria, Bacteroidetes, Bacteroidetes (class), Bacteroidales, Porphyromonadaceae, Porphyromonas","(2176588.0, 2177156.0)",,,,2354886,True,0.4835928363411222,872503,221135.0,7769.0,2176664.0,639483.0,1817872.0,,,,,0.25,0.15,0.15,0.15,0.15,0.15,,,,
NZ_CP009429,"Sphingopyxis macrogoltabida strain 203, complete genome.","Bacteria, Proteobacteria, Alphaproteobacteria, Sphingomonadales, Sphingomonadaceae, Sphingopyxis","(4860289.0, 4860639.0)",,,,5174928,False,0.6514805616619207,5005829,,,,,,,,,,1.0,,,,,,,,,
NC_018024,Anaerobaculum mobile DSM 13181 chromosome,"Bacteria, Synergistetes, Synergistia, Synergistales, Synergistaceae, Anaerobaculum","(2160606.0, 232.0)","(1571.0, 1776.0)",,,2160700,False,0.4796806590456796,2157873,,,,,,,,,,1.0,,,,,,,,,
NZ_CP020028,"Paenibacillus kribbensis strain AM49 chromosome, complete genome.","Bacteria, Firmicutes, Bacilli, Bacillales, Paenibacillaceae, Paenibacillus","(5656771.0, 5657839.0)","(5655238.0, 5655423.0)",,,5778702,False,0.4678514309960956,5709831,,,,,,,,,,1.0,,,,,,,,,
NC_015500,Treponema brennaborense DSM 12168 chromosome,"Bacteria, Spirochaetes, Spirochaetales, Spirochaetaceae, Treponema","(1594.0, 1840.0)",,,,3055580,False,0.5147294458007973,3054004,,,,,,,,,,1.0,,,,,,,,,
NC_013009,Neorickettsia risticii str. Illinois,"Bacteria, Proteobacteria, Alphaproteobacteria, Rickettsiales, Anaplasmataceae, Neorickettsia","(876108.0, 876518.0)",,,,879977,True,0.4127130595458745,225543,877951.0,797045.0,,,,,,,,0.5,0.3,0.2,,,,,,,
NC_023150,Rhodococcus pyridinivorans SB3094,"Bacteria, Actinobacteria, Actinobacteridae, Actinomycetales, Corynebacterineae, Nocardiaceae, Rhodococcus","(3535749.0, 3536335.0)",,,,5227080,True,0.6798457264859157,1805882,557526.0,4277798.0,3195786.0,4735886.0,,,,,,0.3181818181818182,0.3181818181818182,0.1363636363636363,0.1363636363636363,0.0909090909090909,,,,,
NC_012912,Dickeya zeae Ech1591,"Bacteria, Proteobacteria, Gammaproteobacteria, Enterobacteriales, Enterobacteriaceae, Dickeya","(4727076.0, 4727453.0)",,,,4813854,False,0.5451725374305079,4805911,,,,,,,,,,1.0,,,,,,,,,
NC_019960,Prevotella dentalis DSM 3688 chromosome 1,"Bacteria, Bacteroidetes, Bacteroidia, Bacteroidales, Prevotellaceae, Prevotella","(1718562.0, 1719059.0)",,,,1890695,True,0.5609312977502982,772460,1714078.0,1149637.0,9964.0,,,,,,,0.3461538461538461,0.2307692307692307,0.2307692307692307,0.1923076923076923,,,,,,
NZ_CP023465,"Lysobacter capsici strain KNU-14 chromosome, complete genome.","Bacteria, Proteobacteria, Gammaproteobacteria, Xanthomonadales, Xanthomonadaceae, Lysobacter","(1336.0, 2211.0)",,,,6270417,False,0.6680697631433443,16636,647199.0,,,,,,,,,0.8571428571428571,0.1428571428571428,,,,,,,,
NC_012880,Dickeya dadantii Ech703,"Bacteria, Proteobacteria, Gammaproteobacteria, Enterobacteriales, Enterobacteriaceae, Dickeya","(4621562.0, 4621939.0)",,,,4679450,False,0.5501507655814252,4619784,,,,,,,,,,1.0,,,,,,,,,
NZ_CP017713,"Lactobacillus coryniformis subsp. coryniformis KCTC 3167 = DSM 20001 chromosome, complete genome.","Bacteria, Firmicutes, Bacilli, Lactobacillales, Lactobacillaceae, Lactobacillus","(2950983.0, 2951508.0)","(1363.0, 1619.0)",,,2951508,False,0.4312056752006093,1037,,,,,,,,,,1.0,,,,,,,,,
NZ_CP011786,"Bifidobacterium actinocoloniiforme DSM 22766, complete genome.","Bacteria, Actinobacteria, Bifidobacteriales, Bifidobacteriaceae, Bifidobacterium","(1399742.0, 1400162.0)",,,,1830060,False,0.6270783471580167,1410860,1814417.0,,,,,,,,,0.5,0.5,,,,,,,,
NC_013921,Thermoanaerobacter italicus Ab9 chromosome,"Bacteria, Firmicutes, Clostridia, Thermoanaerobacterales, Thermoanaerobacteraceae, Thermoanaerobacter","(2450977.0, 423.0)",,,,2451061,False,0.3414500903894272,1792,,,,,,,,,,1.0,,,,,,,,,
NZ_CP010975,"Kangiella geojedonensis strain YCS-5, complete genome.","Bacteria, Proteobacteria, Gammaproteobacteria, Oceanospirillales, Kangiellaceae, Kangiella","(2494388.0, 2495242.0)",,,,2495242,False,0.4377611470149989,2494292,,,,,,,,,,1.0,,,,,,,,,
NC_013959,Sideroxydans lithotrophicus ES-1 chromosome,"Bacteria, Proteobacteria, Betaproteobacteria, Gallionellales, Gallionellaceae, Sideroxydans","(3003585.0, 71.0)","(1416.0, 1618.0)",,,3003656,False,0.5754174246318486,3195,,,,,,,,,,1.0,,,,,,,,,
NZ_HG916765,Castellaniella defragrans 65Phen complete genome.,"Bacteria, Proteobacteria, Betaproteobacteria, Burkholderiales, Alcaligenaceae, Castellaniella","(3891428.0, 3892068.0)",,,,3952818,False,0.6894167654569474,18375,1836935.0,2187123.0,,,,,,,,0.6875,0.1875,0.125,,,,,,,
NC_016148,Thermovirga lienii DSM 17291 chromosome,"Bacteria, Synergistetes, Synergistia, Synergistales, Synergistaceae, Thermovirga","(1967528.0, 77.0)","(1401.0, 1626.0)",,,1967774,False,0.4705763974928015,698,,,,,,,,,,1.0,,,,,,,,,
NZ_CP018866,"Bacillus cohnii strain DSM 6307 chromosome, complete genome.","Bacteria, Firmicutes, Bacilli, Bacillales, Bacillaceae, Bacillus","(4596934.0, 4597112.0)","(4594941.0, 4595586.0)",,,4899141,True,0.3612986439867723,267,4595959.0,,,,,,,,,0.75,0.25,,,,,,,,
NC_012108,Desulfobacterium autotrophicum HRM2,"Bacteria, Proteobacteria, Deltaproteobacteria, Desulfobacterales, Desulfobacteraceae, Desulfobacterium","(5588316.0, 5589073.0)",,,,5589073,False,0.4884700915518548,5588042,,,,,,,,,,1.0,,,,,,,,,
NC_014259,Acinetobacter sp. DR1 chromosome,"Bacteria, Proteobacteria, Gammaproteobacteria, Pseudomonadales, Moraxellaceae, Acinetobacter","(4152186.0, 323.0)",,,,4152543,False,0.3873207333433994,4152487,,,,,,,,,,1.0,,,,,,,,,
NZ_CP009248,"Corynebacterium sphenisci DSM 44792, complete genome.","Bacteria, Actinobacteria, Corynebacteriales, Corynebacteriaceae, Corynebacterium","(2594188.0, 27.0)","(1786.0, 2229.0)",,,2594799,False,0.7472960333343739,2576037,1172268.0,724803.0,375273.0,,,,,,,0.3793103448275862,0.2758620689655172,0.1724137931034483,0.1724137931034483,,,,,,
NC_012982,Hirschia baltica ATCC 49814,"Bacteria, Proteobacteria, Alphaproteobacteria, Rhodobacterales, Hyphomonadaceae, Hirschia","(3449288.0, 3449705.0)",,,,3455622,False,0.4523012065555781,3449652,,,,,,,,,,1.0,,,,,,,,,
NZ_CP018058,"Geobacillus thermocatenulatus strain KCTC 3921 chromosome, complete genome.","Bacteria, Firmicutes, Bacilli, Bacillales, Bacillaceae, Geobacillus, Geobacillus thermoleovorans group","(273539.0, 274015.0)",,,,3742258,False,0.518892871629909,268628,,,,,,,,,,1.0,,,,,,,,,
NC_006138,Desulfotalea psychrophila LSv54,"Bacteria, Proteobacteria, Deltaproteobacteria, Desulfobacterales, Desulfobulbaceae, Desulfotalea","(709557.0, 709918.0)",,,,3523383,True,0.4681120389126019,28933,732024.0,2370515.0,,,,,,,,0.4375,0.4375,0.125,,,,,,,
NZ_CP009247,"Corynebacterium frankenforstense DSM 45800 strain ST18, complete genome.","Bacteria, Actinobacteria, Corynebacteriales, Corynebacteriaceae, Corynebacterium","(2603363.0, 81.0)","(2056.0, 3280.0)",,,2604152,False,0.7150657872505138,32800,2013043.0,1598756.0,1356752.0,987369.0,733449.0,2409333.0,,,,0.2093023255813953,0.2093023255813953,0.2093023255813953,0.1627906976744186,0.0697674418604651,0.0697674418604651,0.0697674418604651,,,
NZ_CP018725,"Xanthomonas vesicatoria ATCC 35937 strain LMG911 chromosome, complete genome.","Bacteria, Proteobacteria, Gammaproteobacteria, Xanthomonadales, Xanthomonadaceae, Xanthomonas","(2902162.0, 2903139.0)",,,,5110163,False,0.642621771556015,2790019,1163.0,,,,,,,,,0.6428571428571429,0.3571428571428571,,,,,,,,
NC_012969,Methylovorus sp. SIP3-4,"Bacteria, Proteobacteria, Betaproteobacteria, Methylophilales, Methylophilaceae, Methylovorus","(1548.0, 1795.0)",,,,2995511,False,0.5486042281266869,1079,,,,,,,,,,1.0,,,,,,,,,
NZ_AP014940,"Lysobacter enzymogenes DNA, complete genome, strain: M497-1.","Bacteria, Proteobacteria, Gammaproteobacteria, Xanthomonadales, Xanthomonadaceae, Lysobacter","(1514.0, 2264.0)",,,,6096022,False,0.6936356200814235,6070965,1629582.0,,,,,,,,,0.7857142857142857,0.2142857142857142,,,,,,,,
NZ_CP017694,"Geobacillus thermodenitrificans strain KCTC3902 chromosome, complete genome.","Bacteria, Firmicutes, Bacilli, Bacillales, Bacillaceae, Geobacillus","(1839846.0, 1840321.0)","(1838322.0, 1838492.0)",,,3505276,False,0.4910868644865625,1835548,121.0,,,,,,,,,0.5,0.5,,,,,,,,
NC_009937,Azorhizobium caulinodans ORS 571,"Bacteria, Proteobacteria, Alphaproteobacteria, Rhizobiales, Xanthobacteraceae, Azorhizobium","(1.0, 350.0)",,,,5369772,False,0.6731902211118088,5366553,4375308.0,,,,,,,,,0.5625,0.4375,,,,,,,,
NC_014313,Hyphomicrobium denitrificans ATCC 51888 chromosome,"Bacteria, Proteobacteria, Alphaproteobacteria, Rhizobiales, Hyphomicrobiaceae, Hyphomicrobium","(3347129.0, 3347560.0)",,,,3638969,False,0.6081241692358468,4,2074615.0,2429275.0,3148791.0,,,,,,,0.5294117647058824,0.1764705882352941,0.1764705882352941,0.1176470588235294,,,,,,
NC_017079,Caldilinea aerophila DSM 14535 = NBRC 104270,"Bacteria, Chloroflexi, Caldilineae, Caldilineales, Caldilineaceae, Caldilinea","(1054268.0, 1055644.0)",,,,5144873,True,0.5876714546695322,1668367,5139237.0,1067849.0,,,,,,,,0.36,0.36,0.28,,,,,,,
NC_014219,Bacillus selenitireducens MLS10 chromosome,"Bacteria, Firmicutes, Bacillales, Bacillaceae, Bacillus","(3592370.0, 653.0)","(2010.0, 2217.0)",,,3592487,False,0.4866996039234101,4614,,,,,,,,,,1.0,,,,,,,,,
NC_012968,Methylotenera mobilis JLW8,"Bacteria, Proteobacteria, Betaproteobacteria, Methylophilales, Methylophilaceae, Methylotenera","(2547444.0, 201.0)","(1621.0, 1868.0)",,,2547570,False,0.4551019206537995,2547363,,,,,,,,,,1.0,,,,,,,,,
NZ_CP022110,"Nitrospirillum amazonense CBAmc chromosome 1, complete sequence.","Bacteria, Proteobacteria, Alphaproteobacteria, Rhodospirillales, Rhodospirillaceae, Nitrospirillum","(39169.0, 39627.0)",,,,2945703,False,0.6756383790219177,2614,2662079.0,,,,,,,,,0.8,0.2,,,,,,,,
NZ_CP015010,"Rickettsia bellii isolate An04 chromosome, complete genome.","Bacteria, Proteobacteria, Alphaproteobacteria, Rickettsiales, Rickettsiaceae, Rickettsieae, Rickettsia, belli group","(410427.0, 410817.0)",,,,1543886,True,0.3161936826941885,1532461,915346.0,645100.0,403690.0,263852.0,93907.0,,,,,0.2413793103448276,0.2413793103448276,0.2068965517241379,0.1724137931034483,0.0689655172413793,0.0689655172413793,,,,
NC_011837,Clostridium kluyveri NBRC 12016,"Bacteria, Firmicutes, Clostridia, Clostridiales, Clostridiaceae, Clostridium","(3895509.0, 3896121.0)","(1357.0, 1614.0)",,,3896121,False,0.3199364188124547,3884769,,,,,,,,,,1.0,,,,,,,,,
NC_019729,Oscillatoria nigro-viridis PCC 7112,"Bacteria, Cyanobacteria, Oscillatoriales, Oscillatoria","(1429.0, 2139.0)",,,,7479014,True,0.4586765046836388,6037921,671056.0,2048978.0,6864243.0,4936587.0,3177158.0,,,,,0.3103448275862069,0.3103448275862069,0.1034482758620689,0.1034482758620689,0.1034482758620689,0.0689655172413793,,,,
NC_019904,Echinicola vietnamensis DSM 17526 chromosome,"Bacteria, Bacteroidetes, Cytophagia, Cytophagales, Cyclobacteriaceae, Echinicola","(1222478.0, 1223077.0)",,,,5608040,False,0.4475369291231874,1227126,,,,,,,,,,1.0,,,,,,,,,
NC_014008,Coraliomargarita akajimensis DSM 45221 chromosome,"Bacteria, Verrucomicrobia, Opitutae, Puniceicoccales, Puniceicoccaceae, Coraliomargarita","(3750770.0, 489.0)",,,,3750771,True,0.5360177947414012,358,2570484.0,,,,,,,,,0.5,0.5,,,,,,,,
NZ_CP007039,"Pseudomonas cichorii JBC1, complete genome.","Bacteria, Proteobacteria, Gammaproteobacteria, Pseudomonadales, Pseudomonadaceae, Pseudomonas","(1915.0, 2499.0)",,,,5986012,False,0.5810337500158703,5980683,,,,,,,,,,1.0,,,,,,,,,
NC_013947,Stackebrandtia nassauensis DSM 44728 chromosome,"Bacteria, Actinobacteria, Actinobacteridae, Actinomycetales, Glycomycineae, Glycomycetaceae, Stackebrandtia","(6841169.0, 63.0)","(1765.0, 2245.0)",,,6841557,True,0.6813393500923839,3337530,435192.0,1079926.0,6652539.0,4717148.0,2141771.0,6050617.0,,,,0.2647058823529412,0.1470588235294117,0.1470588235294117,0.1470588235294117,0.1470588235294117,0.088235294117647,0.0588235294117647,,,
NC_016599,Owenweeksia hongkongensis DSM 17368 chromosome,"Bacteria, Bacteroidetes, Flavobacteriia, Flavobacteriales, Cryomorphaceae, Owenweeksia","(2625050.0, 2625077.0)","(2623145.0, 2623177.0)",,,4000057,False,0.4023350167260116,2579673,1191.0,,,,,,,,,0.6428571428571429,0.3571428571428571,,,,,,,,
NC_014209,Thermoanaerobacter mathranii subsp. mathranii str. A3 chromosome,"Bacteria, Firmicutes, Clostridia, Thermoanaerobacterales, Thermoanaerobacteraceae, Thermoanaerobacter","(2305683.0, 98.0)",,,,2306092,False,0.3432013987299726,7674,,,,,,,,,,1.0,,,,,,,,,
NC_013530,Xylanimonas cellulosilytica DSM 15894,"Bacteria, Actinobacteria, Actinobacteridae, Actinomycetales, Micrococcineae, Promicromonosporaceae, Xylanimonas","(3742473.0, 149.0)","(1557.0, 2110.0)",,,3742776,True,0.7248758675378917,1448956,564709.0,1889856.0,2730.0,2584725.0,3200453.0,,,,,0.2571428571428571,0.2,0.2,0.1714285714285714,0.1142857142857142,0.0571428571428571,,,,
NZ_CP007044,"Chania multitudinisentens RB-25, complete genome.","Bacteria, Proteobacteria, Gammaproteobacteria, Enterobacterales, Yersiniaceae, Chania","(964348.0, 964729.0)",,,,5488183,False,0.5087880633717935,966929,,,,,,,,,,1.0,,,,,,,,,
NC_018014,Terriglobus roseus DSM 18391 chromosome,"Bacteria, Acidobacteria, Acidobacteriales, Acidobacteriaceae, Terriglobus","(5227453.0, 112.0)",,,,5227858,False,0.6028124711880085,28585,2166588.0,4547746.0,3340968.0,1495780.0,2810264.0,,,,,0.2608695652173913,0.1956521739130435,0.1956521739130435,0.1956521739130435,0.108695652173913,0.0434782608695652,,,,
NZ_CP014234,"Moraxella osloensis strain CCUG 350, complete genome.","Bacteria, Proteobacteria, Gammaproteobacteria, Pseudomonadales, Moraxellaceae, Moraxella","(1646535.0, 1647033.0)",,,,2434688,True,0.4385407904421429,1623895,2249896.0,,,,,,,,,0.6,0.4,,,,,,,,
NC_005043,Chlamydophila pneumoniae TW-183,"Bacteria, Chlamydiae, Chlamydiales, Chlamydiaceae, Chlamydophila","(838691.0, 839044.0)",,,,1225935,False,0.40576213257636,842130,631901.0,,,,,,,,,0.75,0.25,,,,,,,,
NZ_CP012033,"Lactobacillus koreensis strain 26-25, complete genome.","Bacteria, Firmicutes, Bacilli, Lactobacillales, Lactobacillaceae, Lactobacillus","(1242609.0, 1243149.0)","(1240942.0, 1241249.0)",,,3006812,False,0.4922708835803502,1238704,3005790.0,,,,,,,,,0.75,0.25,,,,,,,,
NC_014960,Anaerolinea thermophila UNI-1,"Bacteria, Chloroflexi, Anaerolineae, Anaerolineales, Anaerolineaceae, Anaerolinea","(195.0, 533.0)",,,,3532378,False,0.5384967293987223,3506571,,,,,,,,,,1.0,,,,,,,,,
NC_013894,Thermocrinis albus DSM 14484 chromosome,"Bacteria, Aquificae, Aquificales, Aquificaceae, Thermocrinis","(163763.0, 164162.0)",,,,1500577,True,0.4693054738277342,612319,479221.0,1492631.0,1337655.0,897464.0,234367.0,,,,,0.2647058823529412,0.2647058823529412,0.1764705882352941,0.1470588235294117,0.088235294117647,0.0588235294117647,,,,
NC_015186,Acidiphilium multivorum AIU301,"Bacteria, Proteobacteria, Alphaproteobacteria, Rhodospirillales, Acetobacteraceae, Acidiphilium","(3070737.0, 3071016.0)",,,,3749411,True,0.6757917443566469,964205,2338852.0,3034997.0,514271.0,1917697.0,3618475.0,,,,,0.1956521739130435,0.1956521739130435,0.1956521739130435,0.1956521739130435,0.1521739130434782,0.0652173913043478,,,,
NC_013939,Deferribacter desulfuricans SSM1,"Bacteria, Deferribacteres, Deferribacterales, Deferribacteraceae, Deferribacter","(2234308.0, 134.0)",,,,2234389,False,0.3111826096530192,2228831,1155114.0,,,,,,,,,0.7777777777777778,0.2222222222222222,,,,,,,,
NZ_CP013254,"Kocuria flava strain HO-9041, complete genome.","Bacteria, Actinobacteria, Micrococcales, Micrococcaceae, Kocuria","(614174.0, 614855.0)",,,,3504335,True,0.7418177771246185,602350,1593753.0,277106.0,1052887.0,2228714.0,3452630.0,,,,,0.2142857142857142,0.2142857142857142,0.2142857142857142,0.1666666666666666,0.119047619047619,0.0714285714285714,,,,
NC_004556,Xylella fastidiosa Temecula1,"Bacteria, Proteobacteria, Gammaproteobacteria, Xanthomonadales, Xanthomonadaceae, Xylella","(1466.0, 1746.0)",,,,2519802,False,0.5177636973063756,2510447,,,,,,,,,,1.0,,,,,,,,,
NZ_CP016948,"Serratia sp. YD25 chromosome, complete genome.","Bacteria, Proteobacteria, Gammaproteobacteria, Enterobacterales, Yersiniaceae, Serratia","(4431090.0, 4431469.0)",,,,5117644,False,0.5960652987976498,4430013,,,,,,,,,,1.0,,,,,,,,,
NC_014217,Starkeya novella DSM 506 chromosome,"Bacteria, Proteobacteria, Alphaproteobacteria, Rhizobiales, Xanthobacteraceae, Starkeya","(4037458.0, 4037759.0)",,,,4765023,True,0.6788473004222645,446612,886846.0,4079523.0,1298615.0,4702336.0,,,,,,0.45,0.2,0.15,0.1,0.1,,,,,
NZ_CP014070,"Citrobacter amalonaticus strain FDAARGOS_165, complete genome.","Bacteria, Proteobacteria, Gammaproteobacteria, Enterobacterales, Enterobacteriaceae, Citrobacter","(611008.0, 611386.0)",,,,5030678,False,0.5318889422061996,612885,,,,,,,,,,1.0,,,,,,,,,
